X,Y,Name,description,timestamp,begin,end,altitudeMode,tessellate,extrude,visibility,drawOrder,icon,unnamed__1_,Marca_temporal,Calle,Numero_aproximado,Colonia,Delegacion,Nombre_contacto,Telefono,Articulos_Urgentes,Alimentos_Faltantes,Alimentos_Existentes,Medicamentos_Faltantes,Medicamentos_Existentes,Herramientas_Faltantes,Herramientas_Existentes,Otros_Articulos,Horario_Atencion,Requieren_voluntarios,Verificado,Estado,latitud,longitud
-99.166945,19.2775576,Estadio Olimpico Universitario,"unnamed (1): 100<br>Marca temporal: 21/09/17 11:51<br>Calle: Insurgentes Sur<br>Numero_aproximado: 1<br>Colonia: Ciudad Universitaria<br>Delegacion: Coyoacan <br>Nombre_contacto: María Fernanda<br>Telefono: 5540656880<br>Articulos_Urgentes: Impermeables gruesos, chalecos fluorescentes, cinceles, sinsayas (corta pernos 3/8), discos de diamante para cortar, limatones, gatos hidráulicos de botella de 10, clavos de acero para concreto y botas con casquillo<br>Alimentos_Faltantes: Ninguno<br>Alimentos_Existentes: Agua, alimentos no perecederos<br>Medicamentos_Faltantes: ninguno<br>Medicamentos_Existentes: ninguno<br>Herramientas_Faltantes: Impermeables gruesos, chalecos fluorescentes, cinceles, sinsayas (corta pernos 3/8), discos de diamante para cortar, limatones, gatos hidráulicos de botella de 10, clavos de acero para concreto y botas con casquillo<br>Herramientas_Existentes: Ninguno<br>Otros_Articulos: ninguno<br>Horario_Atencion: 24 horas<br>Requieren_voluntarios: No<br>Verificado: Sí<br>Estado: Ciudad de México<br>latitud: 19.2775576<br>longitud: -99.166945",,,,,-1,0,-1,,,100.0,21/09/17 11:51,Insurgentes Sur,1.0,Ciudad Universitaria,Coyoacan,María Fernanda,5540656880,"Impermeables gruesos, chalecos fluorescentes, cinceles, sinsayas (corta pernos 3/8), discos de diamante para cortar, limatones, gatos hidráulicos de botella de 10, clavos de acero para concreto y botas con casquillo",Ninguno,"Agua, alimentos no perecederos",ninguno,ninguno,"Impermeables gruesos, chalecos fluorescentes, cinceles, sinsayas (corta pernos 3/8), discos de diamante para cortar, limatones, gatos hidráulicos de botella de 10, clavos de acero para concreto y botas con casquillo",Ninguno,ninguno,24 horas,No,Sí,Ciudad de México,19.2775576,-99.166945
,,Petén y Zapata,"unnamed (1): 101<br>Marca temporal: 21/09/17 12:01<br>Calle: Petén y Zapata, entrando por Divisiòn y Zapata<br>Numero_aproximado: 0<br>Colonia: Santa Cruz Atoyac, residencial Emperadores<br>Delegacion: Benito Juàrez<br>Nombre_contacto: Miguel<br>Telefono: 4.4554E+11<br>Articulos_Urgentes: Ventiladores industriales o los que haya para alejar humos nocivos<br>Alimentos_Faltantes: ninguno <br>Alimentos_Existentes: ninguno<br>Medicamentos_Faltantes: ninguno<br>Medicamentos_Existentes: ninguno<br>Herramientas_Faltantes: Ventiladores industriales<br>Herramientas_Existentes: ninguno<br>Otros_Articulos: ninguno<br>Horario_Atencion: a partir de 11:15 am<br>Requieren_voluntarios: No<br>Verificado: Sí<br>Estado: Ciudad de México<br>latitud: <br>longitud:",,,,,,,-1,,,101.0,21/09/17 12:01,"Petén y Zapata, entrando por Divisiòn y Zapata",0.0,"Santa Cruz Atoyac, residencial Emperadores",Benito Juàrez,Miguel,4.4554E+11,Ventiladores industriales o los que haya para alejar humos nocivos,ninguno,ninguno,ninguno,ninguno,Ventiladores industriales,ninguno,ninguno,a partir de 11:15 am,No,Sí,Ciudad de México,,
,,Zócalo Puebla Capital,"unnamed (1): 102<br>Marca temporal: 21/09/17 12:07<br>Calle: 3 Oriente a un lado de la Catedral<br>Numero_aproximado: 0<br>Colonia: Centro<br>Delegacion: Puebla<br>Nombre_contacto: Yatziri Zepeda<br>Telefono: 222 7208799<br>Articulos_Urgentes: Cajas de cartón para transportar víveres, filtros de agua, garrafones vacíos para hacer llegar agua potable<br>Alimentos_Faltantes: frijoles, lentejas, arroz, atún, sardinas, pasta, tomate en salsa, galletas, pan de caja, y otros alimentos no perecederos y/o enlatados, agua embotellada, papel higiénico, toallas sanitarias, pañales, jabon, detergente, limpiadores, toallas, cobijas, palas, picos, cubrebocas, materiales de limpieza de heridas     <br>  <br>Alimentos_Existentes: -<br>Medicamentos_Faltantes: analgésicos, antibióticos<br>Medicamentos_Existentes: -<br>Herramientas_Faltantes: palas, picos, cubetas, carretillas, cortadores de varilla<br>Herramientas_Existentes: -<br>Otros_Articulos: -<br>Horario_Atencion: 24 horas<br>Requieren_voluntarios: No<br>Verificado: Sí<br>Estado: Puebla<br>latitud: <br>longitud:",,,,,,,-1,,,102.0,21/09/17 12:07,3 Oriente a un lado de la Catedral,0.0,Centro,Puebla,Yatziri Zepeda,222 7208799,"Cajas de cartón para transportar víveres, filtros de agua, garrafones vacíos para hacer llegar agua potable","frijoles, lentejas, arroz, atún, sardinas, pasta, tomate en salsa, galletas, pan de caja, y otros alimentos no perecederos y/o enlatados, agua embotellada, papel higiénico, toallas sanitarias, pañales, jabon, detergente, limpiadores, toallas, cobijas, palas, picos, cubrebocas, materiales de limpieza de heridas",-,"analgésicos, antibióticos",-,"palas, picos, cubetas, carretillas, cortadores de varilla",-,-,24 horas,No,Sí,Puebla,,
,,IMIFAP,"unnamed (1): 103<br>Marca temporal: 21/09/17 12:08<br>Calle: Málaga Norte<br>Numero_aproximado: 25<br>Colonia: Insurgentes Mixcoac<br>Delegacion: Benito Juárez<br>Nombre_contacto: Jorge Miranda<br>Telefono: 4530747037<br>Articulos_Urgentes: Ninguno<br>Alimentos_Faltantes: Pañales, Jabón, Cobijas, Papel sanitario, Toallas sanitarias, Alimento para bebé, Atún, Café soluble, Azúcar, Galletas saladas, Galletas dulces, Sardinas, Alimentos en lata abre-fácil<br>Alimentos_Existentes: Ninguno<br>Medicamentos_Faltantes: Ninguno<br>Medicamentos_Existentes: Ninguno<br>Herramientas_Faltantes: Ninguno<br>Herramientas_Existentes: Ninugno<br>Otros_Articulos: Ninguno<br>Horario_Atencion: 8:30 a 18:30<br>Requieren_voluntarios: No<br>Verificado: No<br>Estado: Ciudad de México<br>latitud: <br>longitud:",,,,,,,-1,,,103.0,21/09/17 12:08,Málaga Norte,25.0,Insurgentes Mixcoac,Benito Juárez,Jorge Miranda,4530747037,Ninguno,"Pañales, Jabón, Cobijas, Papel sanitario, Toallas sanitarias, Alimento para bebé, Atún, Café soluble, Azúcar, Galletas saladas, Galletas dulces, Sardinas, Alimentos en lata abre-fácil",Ninguno,Ninguno,Ninguno,Ninguno,Ninugno,Ninguno,8:30 a 18:30,No,No,Ciudad de México,,
,,Sala Chopin,"unnamed (1): 104<br>Marca temporal: 21/09/17 12:11<br>Calle: Avenida Álvaro Obregón 302<br>Numero_aproximado: 302<br>Colonia: Roma Norte<br>Delegacion: Cuauhtemoc<br>Nombre_contacto: Marce<br>Telefono: 4.4554E+11<br>Articulos_Urgentes: soluciones 500 ml, solución Hartman salina 0.9%, equipo de venoclisis, punzocat verde u azul, tablas de rescate con arnes, glocòmetro, saturas, <br>Alimentos_Faltantes: ninguno<br>Alimentos_Existentes: ninguno<br>Medicamentos_Faltantes: ninguno<br>Medicamentos_Existentes: ninguno<br>Herramientas_Faltantes: ninguno<br>Herramientas_Existentes: ninguno<br>Otros_Articulos: ninguno<br>Horario_Atencion: <br>Requieren_voluntarios: No<br>Verificado: Sí<br>Estado: Ciudad de México<br>latitud: <br>longitud:",,,,,,,-1,,,104.0,21/09/17 12:11,Avenida Álvaro Obregón 302,302.0,Roma Norte,Cuauhtemoc,Marce,4.4554E+11,"soluciones 500 ml, solución Hartman salina 0.9%, equipo de venoclisis, punzocat verde u azul, tablas de rescate con arnes, glocòmetro, saturas,",ninguno,ninguno,ninguno,ninguno,ninguno,ninguno,ninguno,,No,Sí,Ciudad de México,,
-99.2712081,19.361229,Universidad Iberoamericana,"unnamed (1): 105<br>Marca temporal: 21/09/17 12:16<br>Calle: Prolongacion Paseo de la Reforma <br>Numero_aproximado: 880<br>Colonia: Santa Fe<br>Delegacion: Cuajimalpa<br>Nombre_contacto: Neftalí Hernández<br>Telefono: 5513427753<br>Articulos_Urgentes: Medicamentos y herramientas, cubrebocas, equipos de curacion, algodón, guantes, palas, picos, herramienta para recoger escombros.<br>Alimentos_Faltantes: No hace falta<br>Alimentos_Existentes: No hace falta<br>Medicamentos_Faltantes: equipos de curacion, algodón, guantes<br>Medicamentos_Existentes: no<br>Herramientas_Faltantes: Palas, picos, herramientas para mover escombro<br>Herramientas_Existentes: No<br>Otros_Articulos: No<br>Horario_Atencion: 12:20<br>Requieren_voluntarios: No<br>Verificado: Sí<br>Estado: Ciudad de México<br>latitud: 19.361229<br>longitud: -99.2712081",,,,,-1,0,-1,,,105.0,21/09/17 12:16,Prolongacion Paseo de la Reforma,880.0,Santa Fe,Cuajimalpa,Neftalí Hernández,5513427753,"Medicamentos y herramientas, cubrebocas, equipos de curacion, algodón, guantes, palas, picos, herramienta para recoger escombros.",No hace falta,No hace falta,"equipos de curacion, algodón, guantes",no,"Palas, picos, herramientas para mover escombro",No,No,12:20,No,Sí,Ciudad de México,19.361229,-99.2712081
,,Aurrerá-Autopista México-Querétaro,"unnamed (1): 106<br>Marca temporal: 21/09/17 12:23<br>Calle: Avenida de los fresnos<br>Numero_aproximado: 69<br>Colonia: Arcos del alba<br>Delegacion: Cuautitlán Izcalli<br>Nombre_contacto: Diana Zurit Caballero Ortiz<br>Telefono: 4.45534E+11<br>Articulos_Urgentes: Enlatados, de higiene personal, material para remover escombros<br>Alimentos_Faltantes: Enlatados<br>Alimentos_Existentes: 0<br>Medicamentos_Faltantes: Analgesicos<br>Medicamentos_Existentes: 0<br>Herramientas_Faltantes: Cascos, guantes, picos, palas<br>Herramientas_Existentes: 0<br>Otros_Articulos: Dulces, ropa<br>Horario_Atencion: 10:00 am - 11:00 pm<br>Requieren_voluntarios: No<br>Verificado: Sí<br>Estado: Estado de México<br>latitud: <br>longitud:",,,,,,,-1,,,106.0,21/09/17 12:23,Avenida de los fresnos,69.0,Arcos del alba,Cuautitlán Izcalli,Diana Zurit Caballero Ortiz,4.45534E+11,"Enlatados, de higiene personal, material para remover escombros",Enlatados,0,Analgesicos,0,"Cascos, guantes, picos, palas",0,"Dulces, ropa",10:00 am - 11:00 pm,No,Sí,Estado de México,,
-99.1594853,19.3478154,MUSA,"unnamed (1): 107<br>Marca temporal: 21/09/17 12:31<br>Calle: Vallarta<br>Numero_aproximado: 7<br>Colonia: Barrio de la Concepción<br>Delegacion: Coyoacán<br>Nombre_contacto: Pilar Arévalo<br>Telefono: 044 55 14 74 88 29<br>Articulos_Urgentes: Papel, pinceles, crayolas, acuarelas, libros para niños, juguetes en buen estado, colores.<br>Alimentos_Faltantes: Dulces<br>Alimentos_Existentes: No aplica<br>Medicamentos_Faltantes: No medicamentos<br>Medicamentos_Existentes: No aplica<br>Herramientas_Faltantes: No aplica<br>Herramientas_Existentes: No aplica<br>Otros_Articulos: Ninguno<br>Horario_Atencion: 12 a 4 pm<br>Requieren_voluntarios: Sí<br>Verificado: Sí<br>Estado: Ciudad de México<br>latitud: 19.3478154<br>longitud: -99.1594853",,,,,-1,0,-1,,,107.0,21/09/17 12:31,Vallarta,7.0,Barrio de la Concepción,Coyoacán,Pilar Arévalo,044 55 14 74 88 29,"Papel, pinceles, crayolas, acuarelas, libros para niños, juguetes en buen estado, colores.",Dulces,No aplica,No medicamentos,No aplica,No aplica,No aplica,Ninguno,12 a 4 pm,Sí,Sí,Ciudad de México,19.3478154,-99.1594853
-99.1847363,19.4886907,Rock y ruedas,"unnamed (1): 108<br>Marca temporal: 21/09/17 12:32<br>Calle: Santos Degollado<br>Numero_aproximado: 943<br>Colonia: Los Angeles<br>Delegacion: Toluca<br>Nombre_contacto: Alejandra Herrera<br>Telefono: 7223903883<br>Articulos_Urgentes: Jeringas para insulina, material de curación, analgésicos, cacerolas y trastes para cocinar<br>Alimentos_Faltantes: Aceite para cocinar, dulces, cereales para niños, azúcar, leche en polvo<br>Alimentos_Existentes: Nada<br>Medicamentos_Faltantes: Insulina, jeringas para insulina, analgésicos.<br>Medicamentos_Existentes: Nada<br>Herramientas_Faltantes: Guantes, picos, palas, lamparas, pilas, costales.<br>Herramientas_Existentes: Nada<br>Otros_Articulos: Articulos de higiene personal<br>Horario_Atencion: 10:00 a 22:00<br>Requieren_voluntarios: Sí<br>Verificado: No<br>Estado: Estado de México<br>latitud: 19.4886907<br>longitud: -99.1847363",,,,,-1,0,-1,,,108.0,21/09/17 12:32,Santos Degollado,943.0,Los Angeles,Toluca,Alejandra Herrera,7223903883,"Jeringas para insulina, material de curación, analgésicos, cacerolas y trastes para cocinar","Aceite para cocinar, dulces, cereales para niños, azúcar, leche en polvo",Nada,"Insulina, jeringas para insulina, analgésicos.",Nada,"Guantes, picos, palas, lamparas, pilas, costales.",Nada,Articulos de higiene personal,10:00 a 22:00,Sí,No,Estado de México,19.4886907,-99.1847363
,,Colegio Alemán-Campus Norte-Plantel Lomas Verdes,"unnamed (1): 109<br>Marca temporal: 21/09/17 12:35<br>Calle: Super Avenida Lomas Verdes<br>Numero_aproximado: 520<br>Colonia: Alteña II<br>Delegacion: Naucalpan de Juarez, Lomas Verdes<br>Nombre_contacto: Colegio Alemán<br>Telefono: 3002 7544<br>Articulos_Urgentes: No especifica<br>Alimentos_Faltantes: Enlatados, atún, sardinas, sopa, frijoles, mayonesa, leche en polvo, galletas, café soluble, arroz<br>Alimentos_Existentes: No especifica<br>Medicamentos_Faltantes: Material de curación, jeringas, electrolitos<br>Medicamentos_Existentes: No especifica<br>Herramientas_Faltantes: Cubetas, guantes de carnaza, linternas, pilas, focos, extensiones<br>Herramientas_Existentes: No especifica<br>Otros_Articulos: Cloro, trapeadores, escobas, ropa nueva, ropa usada, zapatos, sábanas, cobijas, jabón, cepillos de dientes, papel higiénico, toallas sanitarias, pañales, detergentes<br>Horario_Atencion: 21 de septiembre 2017 de 8:00 a 17:00 horas<br>Requieren_voluntarios: No<br>Verificado: Sí<br>Estado: Estado de México<br>latitud: <br>longitud:",,,,,,,-1,,,109.0,21/09/17 12:35,Super Avenida Lomas Verdes,520.0,Alteña II,"Naucalpan de Juarez, Lomas Verdes",Colegio Alemán,3002 7544,No especifica,"Enlatados, atún, sardinas, sopa, frijoles, mayonesa, leche en polvo, galletas, café soluble, arroz",No especifica,"Material de curación, jeringas, electrolitos",No especifica,"Cubetas, guantes de carnaza, linternas, pilas, focos, extensiones",No especifica,"Cloro, trapeadores, escobas, ropa nueva, ropa usada, zapatos, sábanas, cobijas, jabón, cepillos de dientes, papel higiénico, toallas sanitarias, pañales, detergentes",21 de septiembre 2017 de 8:00 a 17:00 horas,No,Sí,Estado de México,,
-99.1724153,19.3722929,Unidad Miguel Alemán,"unnamed (1): 110<br>Marca temporal: 21/09/17 12:37<br>Calle: Felix Cuevas<br>Numero_aproximado: 100<br>Colonia: Pdte. Alemán<br>Delegacion: Pdte. Alemán<br>Nombre_contacto: Sra. Enriqueta Dávila Cejudo<br>Telefono: 5511333213<br>Articulos_Urgentes: Ropa, juguetes, paniales para ninios.<br>Alimentos_Faltantes: Todos<br>Alimentos_Existentes: No<br>Medicamentos_Faltantes: Todos<br>Medicamentos_Existentes: No<br>Herramientas_Faltantes: Todas<br>Herramientas_Existentes: No<br>Otros_Articulos: Todos<br>Horario_Atencion: Hasta que la lluvia los corra<br>Requieren_voluntarios: Sí<br>Verificado: Sí<br>Estado: Ciudad de México<br>latitud: 19.3722929<br>longitud: -99.1724153",,,,,-1,0,-1,,,110.0,21/09/17 12:37,Felix Cuevas,100.0,Pdte. Alemán,Pdte. Alemán,Sra. Enriqueta Dávila Cejudo,5511333213,"Ropa, juguetes, paniales para ninios.",Todos,No,Todos,No,Todas,No,Todos,Hasta que la lluvia los corra,Sí,Sí,Ciudad de México,19.3722929,-99.1724153
-99.1700915,19.4125978,Colegio Alemán-Plantel Sur (Xochimilco),"unnamed (1): 111<br>Marca temporal: 21/09/17 12:45<br>Calle: Avenida México<br>Numero_aproximado: 5501<br>Colonia: Huichapan<br>Delegacion: Xochimilco<br>Nombre_contacto: Colegio Alemán <br>Telefono: 01 55 5062 9880<br>Articulos_Urgentes: No especifica<br>Alimentos_Faltantes: Enlatados, atún, sardinas, arroz, sopas, frijoles, mayonesa<br>Alimentos_Existentes: No especifica<br>Medicamentos_Faltantes: Material de curación, jeringas, electrolitos<br>Medicamentos_Existentes: No especifica<br>Herramientas_Faltantes: Guantes de carnaza, linternas, pilas, extensiones, focos<br>Herramientas_Existentes: No especifica<br>Otros_Articulos: Detergentes, ropa nueva, ropa usada, zapatos, sábanas, cobijas, jabón, toallas sanitarias, pañales, cepillos de dientes, cubetas, escobas, trapeadores, cloro<br>Horario_Atencion: 21 de septiembre 2017 hasta las 17:00 horas<br>Requieren_voluntarios: No<br>Verificado: Sí<br>Estado: Ciudad de México<br>latitud: 19.4125978<br>longitud: -99.1700915",,,,,-1,0,-1,,,111.0,21/09/17 12:45,Avenida México,5501.0,Huichapan,Xochimilco,Colegio Alemán,01 55 5062 9880,No especifica,"Enlatados, atún, sardinas, arroz, sopas, frijoles, mayonesa",No especifica,"Material de curación, jeringas, electrolitos",No especifica,"Guantes de carnaza, linternas, pilas, extensiones, focos",No especifica,"Detergentes, ropa nueva, ropa usada, zapatos, sábanas, cobijas, jabón, toallas sanitarias, pañales, cepillos de dientes, cubetas, escobas, trapeadores, cloro",21 de septiembre 2017 hasta las 17:00 horas,No,Sí,Ciudad de México,19.4125978,-99.1700915
-99.174313,19.4200725,CENTRO DE ACOPIO PARA MILPA ALTA,"unnamed (1): 112<br>Marca temporal: 21/09/17 12:47<br>Calle: Acapulco<br>Numero_aproximado: 32<br>Colonia: Roma<br>Delegacion: Cuauhtemoc<br>Nombre_contacto: Regina Tattersfield<br>Telefono: 55 2313 6522<br>Articulos_Urgentes: Colchonetas, ropa limpia<br>Alimentos_Faltantes: café, comida enlatada<br>Alimentos_Existentes: Ninguno<br>Medicamentos_Faltantes: No se solicitan<br>Medicamentos_Existentes: Sueros, Jeringas, leche para bebe, analgésicos<br>Herramientas_Faltantes: No se solicitan<br>Herramientas_Existentes: ninguna<br>Otros_Articulos: Casas de campaña<br>Horario_Atencion: Hasta las 11:00 pm / Solo hoy<br>Requieren_voluntarios: No<br>Verificado: Sí<br>Estado: Ciudad de México<br>latitud: 19.4200725<br>longitud: -99.174313",,,,,-1,0,-1,,,112.0,21/09/17 12:47,Acapulco,32.0,Roma,Cuauhtemoc,Regina Tattersfield,55 2313 6522,"Colchonetas, ropa limpia","café, comida enlatada",Ninguno,No se solicitan,"Sueros, Jeringas, leche para bebe, analgésicos",No se solicitan,ninguna,Casas de campaña,Hasta las 11:00 pm / Solo hoy,No,Sí,Ciudad de México,19.4200725,-99.174313
-99.1607751,19.4258425,Cancino Colonia Juarez,unnamed (1): 113<br>Marca temporal: 21/09/17 12:52<br>Calle: Havre<br>Numero_aproximado: 64<br>Colonia: Juarez<br>Delegacion: Cuauhtémoc <br>Nombre_contacto: Eduardo Duvos<br>Telefono: 52073216<br>Articulos_Urgentes: Lo que quieran traer<br>Alimentos_Faltantes: Embotellados no precederos<br>Alimentos_Existentes: Apenas abrieron <br>Medicamentos_Faltantes: Los que quiera. <br>Medicamentos_Existentes: Nada<br>Herramientas_Faltantes: No<br>Herramientas_Existentes: No<br>Otros_Articulos:  No<br>Horario_Atencion: 10 am 9:00 pm<br>Requieren_voluntarios: No<br>Verificado: Sí<br>Estado: Ciudad de México<br>latitud: 19.4258425<br>longitud: -99.1607751,,,,,-1,0,-1,,,113.0,21/09/17 12:52,Havre,64.0,Juarez,Cuauhtémoc,Eduardo Duvos,52073216,Lo que quieran traer,Embotellados no precederos,Apenas abrieron,Los que quiera.,Nada,No,No,No,10 am 9:00 pm,No,Sí,Ciudad de México,19.4258425,-99.1607751
-99.1599013,19.3554376,Sin dato,"unnamed (1): 114<br>Marca temporal: 21/09/17 12:58<br>Calle: Genova y Londres<br>Numero_aproximado: 0<br>Colonia: Juárez<br>Delegacion: Cuauhtémoc<br>Nombre_contacto: Sin dato<br>Telefono: Sin dato<br>Articulos_Urgentes: Comida enlatada, medicamentos<br>Alimentos_Faltantes: Comida enlatada, no precederos<br>Alimentos_Existentes: 0<br>Medicamentos_Faltantes: Antibioticos, jeringas y diverso material<br>Medicamentos_Existentes: 0<br>Herramientas_Faltantes: 0<br>Herramientas_Existentes: Sin dato<br>Otros_Articulos: Sin dato<br>Horario_Atencion: Sin dato<br>Requieren_voluntarios: Sí<br>Verificado: Sí<br>Estado: Ciudad de México<br>latitud: 19.3554376<br>longitud: -99.1599013",,,,,-1,0,-1,,,114.0,21/09/17 12:58,Genova y Londres,0.0,Juárez,Cuauhtémoc,Sin dato,Sin dato,"Comida enlatada, medicamentos","Comida enlatada, no precederos",0,"Antibioticos, jeringas y diverso material",0,0,Sin dato,Sin dato,Sin dato,Sí,Sí,Ciudad de México,19.3554376,-99.1599013
,,kokun,"unnamed (1): 115<br>Marca temporal: 21/09/17 13:04<br>Calle: Av. Río Rhin <br>Numero_aproximado: 47<br>Colonia: Cuauhtémoc<br>Delegacion: na<br>Nombre_contacto: Fernanda Retana<br>Telefono: 5547769742<br>Articulos_Urgentes: Comida,enlatada<br>Alimentos_Faltantes: Na<br>Alimentos_Existentes: Na<br>Medicamentos_Faltantes: Na<br>Medicamentos_Existentes: Na<br>Herramientas_Faltantes: Na<br>Herramientas_Existentes: Na<br>Otros_Articulos: Na<br>Horario_Atencion: <br>Requieren_voluntarios: No<br>Verificado: Sí<br>Estado: Ciudad de México<br>latitud: <br>longitud:",,,,,,,-1,,,115.0,21/09/17 13:04,Av. Río Rhin,47.0,Cuauhtémoc,na,Fernanda Retana,5547769742,"Comida,enlatada",Na,Na,Na,Na,Na,Na,Na,,No,Sí,Ciudad de México,,
,,Londres y Genova,"unnamed (1): 116<br>Marca temporal: 21/09/17 13:14<br>Calle: Londres y Geniva<br>Numero_aproximado: 0<br>Colonia: Juárez<br>Delegacion: Na<br>Nombre_contacto: Nana<br>Telefono: Na<br>Articulos_Urgentes: Alimentos,no,perecederos,comida,enlatada,facil,de,abrir,pañales,gel,antibacterial,palas,picos,guantes<br>Alimentos_Faltantes: Na<br>Alimentos_Existentes: Na<br>Medicamentos_Faltantes: Na<br>Medicamentos_Existentes: Na<br>Herramientas_Faltantes: Na<br>Herramientas_Existentes: Na<br>Otros_Articulos: Na<br>Horario_Atencion: Na<br>Requieren_voluntarios: No<br>Verificado: Sí<br>Estado: Ciudad de México<br>latitud: <br>longitud:",,,,,,,-1,,,116.0,21/09/17 13:14,Londres y Geniva,0.0,Juárez,Na,Nana,Na,"Alimentos,no,perecederos,comida,enlatada,facil,de,abrir,pañales,gel,antibacterial,palas,picos,guantes",Na,Na,Na,Na,Na,Na,Na,Na,No,Sí,Ciudad de México,,
,,Estacionamiento de particular  (valet parking),"unnamed (1): 117<br>Marca temporal: 21/09/17 13:18<br>Calle: alfonso esparza otero <br>Numero_aproximado: 108<br>Colonia: guadalupe inn<br>Delegacion: alvaro obregón<br>Nombre_contacto: Jose Ferrari<br>Telefono: 5551013894<br>Articulos_Urgentes: medicinas<br>Alimentos_Faltantes: ninguno<br>Alimentos_Existentes: ninguno<br>Medicamentos_Faltantes: Alcohol, gasas, vendas, curitas, merteolate etc. Agujas del 1 y del 18, oxígeno, dopamina, adrenalina, slbutamina inhalada, catéter intravenoso de 18 positivo, analgésicos, diclofenaco, ketorolaco, puntas nasales, agua fisiológica de 500, tapabocas, suero, solución harmand, antropina, epinefrina, venoclisis, bentodic, férulas, guantes, microporo, bultos quirúrgicos.<br>Medicamentos_Existentes: ninguno<br>Herramientas_Faltantes: no<br>Herramientas_Existentes: no<br>Otros_Articulos: no<br>Horario_Atencion: 7:00 am hasta 11:00pm<br>Requieren_voluntarios: Sí<br>Verificado: Sí<br>Estado: Ciudad de México<br>latitud: <br>longitud:",,,,,,,-1,,,117.0,21/09/17 13:18,alfonso esparza otero,108.0,guadalupe inn,alvaro obregón,Jose Ferrari,5551013894,medicinas,ninguno,ninguno,"Alcohol, gasas, vendas, curitas, merteolate etc. Agujas del 1 y del 18, oxígeno, dopamina, adrenalina, slbutamina inhalada, catéter intravenoso de 18 positivo, analgésicos, diclofenaco, ketorolaco, puntas nasales, agua fisiológica de 500, tapabocas, suero, solución harmand, antropina, epinefrina, venoclisis, bentodic, férulas, guantes, microporo, bultos quirúrgicos.",ninguno,no,no,no,7:00 am hasta 11:00pm,Sí,Sí,Ciudad de México,,
-98.9730495,19.2125891,Apoyo Psicológico,unnamed (1): 118<br>Marca temporal: 21/09/17 13:18<br>Calle: Francisco Javier Mina<br>Numero_aproximado: 134<br>Colonia: Guerrero<br>Delegacion: CUAUHTEMOC<br>Nombre_contacto: Lorena<br>Telefono: 5566985648<br>Articulos_Urgentes: -<br>Alimentos_Faltantes: -<br>Alimentos_Existentes: -<br>Medicamentos_Faltantes: -<br>Medicamentos_Existentes: -<br>Herramientas_Faltantes: -<br>Herramientas_Existentes: -<br>Otros_Articulos: Brigadas de apoyo psicológico<br>Horario_Atencion: <br>Requieren_voluntarios: Sí<br>Verificado: Sí<br>Estado: Ciudad de México<br>latitud: 19.2125891<br>longitud: -98.9730495,,,,,-1,0,-1,,,118.0,21/09/17 13:18,Francisco Javier Mina,134.0,Guerrero,CUAUHTEMOC,Lorena,5566985648,-,-,-,-,-,-,-,Brigadas de apoyo psicológico,,Sí,Sí,Ciudad de México,19.2125891,-98.9730495
-99.1636608,19.4389563,Fit Corner (Gimnasio),unnamed (1): 119<br>Marca temporal: 21/09/17 13:20<br>Calle: Gabino Barreda<br>Numero_aproximado: 122<br>Colonia: San Rafael<br>Delegacion: Cuauhtemoc<br>Nombre_contacto: Jaime Bandera<br>Telefono: 6304-4830<br>Articulos_Urgentes: ninguno<br>Alimentos_Faltantes: todo<br>Alimentos_Existentes: ninguno<br>Medicamentos_Faltantes: todo<br>Medicamentos_Existentes: ninguno<br>Herramientas_Faltantes: todas<br>Herramientas_Existentes: ninguna<br>Otros_Articulos: Partiran el sábado a Morelos con lo que junten para repartir al<br>Horario_Atencion: 6 am a 10 pm<br>Requieren_voluntarios: No<br>Verificado: Sí<br>Estado: Ciudad de México<br>latitud: 19.4389563<br>longitud: -99.1636608,,,,,-1,0,-1,,,119.0,21/09/17 13:20,Gabino Barreda,122.0,San Rafael,Cuauhtemoc,Jaime Bandera,6304-4830,ninguno,todo,ninguno,todo,ninguno,todas,ninguna,Partiran el sábado a Morelos con lo que junten para repartir al,6 am a 10 pm,No,Sí,Ciudad de México,19.4389563,-99.1636608
-99.1399852,19.3415712,Polideportivo Los Culhuacanes,unnamed (1): 120<br>Marca temporal: 21/09/17 13:24<br>Calle: Av Taxqueña <br>Numero_aproximado: 1811<br>Colonia: EX EJIDO SAN FRANCISCO CULHUACAN<br>Delegacion: COYOACAN<br>Nombre_contacto: GABRIELA CAMACHO<br>Telefono: 5561381975<br>Articulos_Urgentes: -<br>Alimentos_Faltantes: -<br>Alimentos_Existentes: -<br>Medicamentos_Faltantes: -<br>Medicamentos_Existentes: -<br>Herramientas_Faltantes: -<br>Herramientas_Existentes: -<br>Otros_Articulos: Brigadas de apoyo psicológico<br>Horario_Atencion: <br>Requieren_voluntarios: Sí<br>Verificado: Sí<br>Estado: Ciudad de México<br>latitud: 19.3415712<br>longitud: -99.1399852,,,,,-1,0,-1,,,120.0,21/09/17 13:24,Av Taxqueña,1811.0,EX EJIDO SAN FRANCISCO CULHUACAN,COYOACAN,GABRIELA CAMACHO,5561381975,-,-,-,-,-,-,-,Brigadas de apoyo psicológico,,Sí,Sí,Ciudad de México,19.3415712,-99.1399852
