X,Y,Name,description,timestamp,begin,end,altitudeMode,tessellate,extrude,visibility,drawOrder,icon,unnamed__1_,Marca_temporal,Calle,Numero_aproximado,Colonia,Delegacion,Nombre_contacto,Telefono,Articulos_Urgentes,Alimentos_Faltantes,Alimentos_Existentes,Medicamentos_Faltantes,Medicamentos_Existentes,Herramientas_Faltantes,Herramientas_Existentes,Otros_Articulos,Horario_Atencion,Requieren_voluntarios,Verificado,Estado,latitud,longitud
-99.1045884,19.4542429,,"unnamed (1): 79<br>Marca temporal: 21/09/17 01:27<br>Calle: Oriente 85<br>Numero_aproximado: 2822<br>Colonia: Siete de Noviembre<br>Delegacion: Gustavo A. Madero<br>Nombre_contacto: 0<br>Telefono: 0<br>Articulos_Urgentes: 0<br>Alimentos_Faltantes: 01:22<br><br>Alimento para bebé, Atún en lata o bolsa, Frijoles en bolsa, arroz en bolsa, Aceite para cocinar<br>Alimentos_Existentes: 0<br>Medicamentos_Faltantes: Vendas, Gasas esterlizadas, Alcohol, Agua oxigenada<br><br>Antihipertensivos, Metformina, Antidiarréicos<br>Medicamentos_Existentes: 0<br>Herramientas_Faltantes: 0<br>Herramientas_Existentes: 0<br>Otros_Articulos: Papel sanitario, Toallas femeninas, Pañales, Jabón de pastilla, Toallas húmedas, Biberones<br>Horario_Atencion: 08:00-21:00<br>Requieren_voluntarios: <br>Verificado: Sí<br>Estado: Ciudad de México<br>latitud: 19.4542429<br>longitud: -99.1045884",,,,,-1,0,-1,,,79.0,21/09/17 01:27,Oriente 85,2822.0,Siete de Noviembre,Gustavo A. Madero,0,0,0,"01:22

Alimento para bebé, Atún en lata o bolsa, Frijoles en bolsa, arroz en bolsa, Aceite para cocinar",0,"Vendas, Gasas esterlizadas, Alcohol, Agua oxigenada

Antihipertensivos, Metformina, Antidiarréicos",0,0,0,"Papel sanitario, Toallas femeninas, Pañales, Jabón de pastilla, Toallas húmedas, Biberones",08:00-21:00,,Sí,Ciudad de México,19.4542429,-99.1045884
-99.1708143,19.3612853,,"unnamed (1): 80<br>Marca temporal: 21/09/17 01:29<br>Calle: Av. Universidad<br>Numero_aproximado: 1790<br>Colonia: Copilco<br>Delegacion: Coyoacán<br>Nombre_contacto: 0<br>Telefono: 0<br>Articulos_Urgentes: 0<br>Alimentos_Faltantes: Alimento para bebé, Atún en lata o bolsa, Frijoles en bolsa, arroz en bolsa, Aceite para cocinar<br>Alimentos_Existentes: 0<br>Medicamentos_Faltantes: Vendas, Gasas esterlizadas, Alcohol, Agua oxigenada<br>Antihipertensivos, Metformina, Antidiarréicos<br>Medicamentos_Existentes: 0<br>Herramientas_Faltantes: 0<br>Herramientas_Existentes: 0<br>Otros_Articulos: Papel sanitario, Toallas femeninas, Pañales, Jabón de pastilla, Toallas húmedas, Biberones<br>Horario_Atencion: 08:00-21:00<br>Requieren_voluntarios: Sí<br>Verificado: Sí<br>Estado: Ciudad de México<br>latitud: 19.3612853<br>longitud: -99.1708143",,,,,-1,0,-1,,,80.0,21/09/17 01:29,Av. Universidad,1790.0,Copilco,Coyoacán,0,0,0,"Alimento para bebé, Atún en lata o bolsa, Frijoles en bolsa, arroz en bolsa, Aceite para cocinar",0,"Vendas, Gasas esterlizadas, Alcohol, Agua oxigenada
Antihipertensivos, Metformina, Antidiarréicos",0,0,0,"Papel sanitario, Toallas femeninas, Pañales, Jabón de pastilla, Toallas húmedas, Biberones",08:00-21:00,Sí,Sí,Ciudad de México,19.3612853,-99.1708143
,,Centro de acopio Zocalo,"unnamed (1): 81<br>Marca temporal: 21/09/17 01:29<br>Calle: Plancha del zócalo capitalino <br>Numero_aproximado: 0<br>Colonia: Centro <br>Delegacion: Cuauhtémoc <br>Nombre_contacto: Fernanda Carrasco <br>Telefono: 5552140068<br>Articulos_Urgentes: Aceite, café, lentejas, sal, azucar, bolsas y cereal <br>Alimentos_Faltantes: Alimentos no perecederos <br>Alimentos_Existentes: Agua<br>Medicamentos_Faltantes: analgésicos, solución fisiológica <br>Medicamentos_Existentes: Ropa<br>Herramientas_Faltantes: Picos, palas, extensiones <br>Herramientas_Existentes: Ninguno <br>Otros_Articulos: Pañales <br>Horario_Atencion: 24 horas <br>Requieren_voluntarios: Sí<br>Verificado: Sí<br>Estado: Ciudad de México<br>latitud: <br>longitud:",,,,,,,-1,,,81.0,21/09/17 01:29,Plancha del zócalo capitalino,0.0,Centro,Cuauhtémoc,Fernanda Carrasco,5552140068,"Aceite, café, lentejas, sal, azucar, bolsas y cereal",Alimentos no perecederos,Agua,"analgésicos, solución fisiológica",Ropa,"Picos, palas, extensiones",Ninguno,Pañales,24 horas,Sí,Sí,Ciudad de México,,
-99.0328768,19.3022931,,"unnamed (1): 82<br>Marca temporal: 21/09/17 01:33<br>Calle: Calle de la Luz<br>Numero_aproximado: 43<br>Colonia: Chapultepec<br>Delegacion: 0<br>Nombre_contacto: 0<br>Telefono: 0<br>Articulos_Urgentes: 0<br>Alimentos_Faltantes: Alimento para bebé, Atún en lata o bolsa, Frijoles en bolsa, arroz en bolsa, Aceite para cocinar<br>Alimentos_Existentes: 0<br>Medicamentos_Faltantes: Vendas, Gasas esterlizadas, Alcohol, Agua oxigenada, Antihipertensivos, Metformina, Antidiarréicos<br>Medicamentos_Existentes: 0<br>Herramientas_Faltantes: 0<br>Herramientas_Existentes: 0<br>Otros_Articulos: Papel sanitario, Toallas femeninas, Pañales, Jabón de pastilla, Toallas húmedas, Biberones<br>Horario_Atencion: 08:00-21:00<br>Requieren_voluntarios: <br>Verificado: Sí<br>Estado: Ciudad de México<br>latitud: 19.3022931<br>longitud: -99.0328768",,,,,-1,0,-1,,,82.0,21/09/17 01:33,Calle de la Luz,43.0,Chapultepec,0,0,0,0,"Alimento para bebé, Atún en lata o bolsa, Frijoles en bolsa, arroz en bolsa, Aceite para cocinar",0,"Vendas, Gasas esterlizadas, Alcohol, Agua oxigenada, Antihipertensivos, Metformina, Antidiarréicos",0,0,0,"Papel sanitario, Toallas femeninas, Pañales, Jabón de pastilla, Toallas húmedas, Biberones",08:00-21:00,,Sí,Ciudad de México,19.3022931,-99.0328768
-99.0136069,19.3641347,,"unnamed (1): 83<br>Marca temporal: 21/09/17 01:35<br>Calle: Calle Edén <br>Numero_aproximado: 44<br>Colonia: Las Águilas<br>Delegacion: Alvaro Obregón<br>Nombre_contacto: 0<br>Telefono: 0<br>Articulos_Urgentes: 0<br>Alimentos_Faltantes: Alimento para bebé, Atún en lata o bolsa, Frijoles en bolsa, arroz en bolsa, Aceite para cocinar<br>Alimentos_Existentes: 0<br>Medicamentos_Faltantes: Vendas, Gasas esterlizadas, Alcohol, Agua oxigenada, Antihipertensivos, Metformina, Antidiarréicos<br>Medicamentos_Existentes: 0<br>Herramientas_Faltantes: 0<br>Herramientas_Existentes: 0<br>Otros_Articulos: Papel sanitario, Toallas femeninas, Pañales, Jabón de pastilla, Toallas húmedas, Biberones<br>Horario_Atencion: 08:00-21:00<br>Requieren_voluntarios: <br>Verificado: Sí<br>Estado: Ciudad de México<br>latitud: 19.3641347<br>longitud: -99.0136069",,,,,-1,0,-1,,,83.0,21/09/17 01:35,Calle Edén,44.0,Las Águilas,Alvaro Obregón,0,0,0,"Alimento para bebé, Atún en lata o bolsa, Frijoles en bolsa, arroz en bolsa, Aceite para cocinar",0,"Vendas, Gasas esterlizadas, Alcohol, Agua oxigenada, Antihipertensivos, Metformina, Antidiarréicos",0,0,0,"Papel sanitario, Toallas femeninas, Pañales, Jabón de pastilla, Toallas húmedas, Biberones",08:00-21:00,,Sí,Ciudad de México,19.3641347,-99.0136069
-99.1734513,19.3971296,,"unnamed (1): 84<br>Marca temporal: 21/09/17 01:36<br>Calle: Calle Galvestón<br>Numero_aproximado: 48<br>Colonia: Nápoles<br>Delegacion: Benito Juárez<br>Nombre_contacto: 0<br>Telefono: 0<br>Articulos_Urgentes: 0<br>Alimentos_Faltantes: Alimento para bebé, Atún en lata o bolsa, Frijoles en bolsa, arroz en bolsa, Aceite para cocinar<br>Alimentos_Existentes: 0<br>Medicamentos_Faltantes: Vendas, Gasas esterlizadas, Alcohol, Agua oxigenada, Antihipertensivos, Metformina, Antidiarréicos<br>Medicamentos_Existentes: 0<br>Herramientas_Faltantes: 0<br>Herramientas_Existentes: 0<br>Otros_Articulos: Papel sanitario, Toallas femeninas, Pañales, Jabón de pastilla, Toallas húmedas, Biberones<br>Horario_Atencion: 08:00-21:00<br>Requieren_voluntarios: <br>Verificado: Sí<br>Estado: Ciudad de México<br>latitud: 19.3971296<br>longitud: -99.1734513",,,,,-1,0,-1,,,84.0,21/09/17 01:36,Calle Galvestón,48.0,Nápoles,Benito Juárez,0,0,0,"Alimento para bebé, Atún en lata o bolsa, Frijoles en bolsa, arroz en bolsa, Aceite para cocinar",0,"Vendas, Gasas esterlizadas, Alcohol, Agua oxigenada, Antihipertensivos, Metformina, Antidiarréicos",0,0,0,"Papel sanitario, Toallas femeninas, Pañales, Jabón de pastilla, Toallas húmedas, Biberones",08:00-21:00,,Sí,Ciudad de México,19.3971296,-99.1734513
-99.1603546,19.525432,,"unnamed (1): 85<br>Marca temporal: 21/09/17 01:39<br>Calle: Emiliano Zapata<br>Numero_aproximado: 7<br>Colonia: Ticuman Centro<br>Delegacion: Tlaltizapan<br>Nombre_contacto: 0<br>Telefono: 0<br>Articulos_Urgentes: 0<br>Alimentos_Faltantes: Alimento para bebé, Atún en lata o bolsa, Frijoles en bolsa, arroz en bolsa, Aceite para cocinar<br>Alimentos_Existentes: 0<br>Medicamentos_Faltantes: Vendas, Gasas esterlizadas, Alcohol, Agua oxigenada, Antihipertensivos, Metformina, Antidiarréicos<br>Medicamentos_Existentes: 0<br>Herramientas_Faltantes: 0<br>Herramientas_Existentes: 0<br>Otros_Articulos: Papel sanitario, Toallas femeninas, Pañales, Jabón de pastilla, Toallas húmedas, Biberones<br>Horario_Atencion: 08:00-21:00<br>Requieren_voluntarios: <br>Verificado: Sí<br>Estado: Morelos<br>latitud: 19.525432<br>longitud: -99.1603546",,,,,-1,0,-1,,,85.0,21/09/17 01:39,Emiliano Zapata,7.0,Ticuman Centro,Tlaltizapan,0,0,0,"Alimento para bebé, Atún en lata o bolsa, Frijoles en bolsa, arroz en bolsa, Aceite para cocinar",0,"Vendas, Gasas esterlizadas, Alcohol, Agua oxigenada, Antihipertensivos, Metformina, Antidiarréicos",0,0,0,"Papel sanitario, Toallas femeninas, Pañales, Jabón de pastilla, Toallas húmedas, Biberones",08:00-21:00,,Sí,Morelos,19.525432,-99.1603546
-99.2729496,19.3341958,,"unnamed (1): 86<br>Marca temporal: 21/09/17 01:40<br>Calle: Camino Viejo a Mixcoac<br>Numero_aproximado: 100<br>Colonia: San Bartolo Ameyalco<br>Delegacion: Álvaro Obregón<br>Nombre_contacto: 0<br>Telefono: 0<br>Articulos_Urgentes: 0<br>Alimentos_Faltantes: Alimento para bebé, Atún en lata o bolsa, Frijoles en bolsa, arroz en bolsa, Aceite para cocinar<br>Alimentos_Existentes: 0<br>Medicamentos_Faltantes: Vendas, Gasas esterlizadas, Alcohol, Agua oxigenada, Antihipertensivos, Metformina, Antidiarréicos<br>Medicamentos_Existentes: 0<br>Herramientas_Faltantes: 0<br>Herramientas_Existentes: 0<br>Otros_Articulos: Papel sanitario, Toallas femeninas, Pañales, Jabón de pastilla, Toallas húmedas, Biberones<br>Horario_Atencion: 08:00-21:00<br>Requieren_voluntarios: <br>Verificado: Sí<br>Estado: Ciudad de México<br>latitud: 19.3341958<br>longitud: -99.2729496",,,,,-1,0,-1,,,86.0,21/09/17 01:40,Camino Viejo a Mixcoac,100.0,San Bartolo Ameyalco,Álvaro Obregón,0,0,0,"Alimento para bebé, Atún en lata o bolsa, Frijoles en bolsa, arroz en bolsa, Aceite para cocinar",0,"Vendas, Gasas esterlizadas, Alcohol, Agua oxigenada, Antihipertensivos, Metformina, Antidiarréicos",0,0,0,"Papel sanitario, Toallas femeninas, Pañales, Jabón de pastilla, Toallas húmedas, Biberones",08:00-21:00,,Sí,Ciudad de México,19.3341958,-99.2729496
-99.1975615,19.4318042,Centralito,"unnamed (1): 87<br>Marca temporal: 21/09/17 08:28<br>Calle: Anatole France<br>Numero_aproximado: 70<br>Colonia: Polanco<br>Delegacion: Miguel Hidalgo<br>Nombre_contacto: Roberto Slim<br>Telefono: 5554057072<br>Articulos_Urgentes: <br>Impermeables, Mamilas<br>Alimentos_Faltantes: No perecederos<br>Alimentos_Existentes: Agua de coco<br>Medicamentos_Faltantes: Adrenalina, xylocaina<br>Medicamentos_Existentes: <br>Herramientas_Faltantes: Pilas D, Lámparas, Seguetas, Cadenas, Guantes latex, Guantes carnaza, Palas<br>Herramientas_Existentes: <br>Otros_Articulos: Bolsas Jumbo de Basura<br>Horario_Atencion: 10am - 10pm<br>Requieren_voluntarios: No<br>Verificado: No<br>Estado: Ciudad de México<br>latitud: 19.4318042<br>longitud: -99.1975615",,,,,-1,0,-1,,,87.0,21/09/17 08:28,Anatole France,70.0,Polanco,Miguel Hidalgo,Roberto Slim,5554057072,"Impermeables, Mamilas",No perecederos,Agua de coco,"Adrenalina, xylocaina",,"Pilas D, Lámparas, Seguetas, Cadenas, Guantes latex, Guantes carnaza, Palas",,Bolsas Jumbo de Basura,10am - 10pm,No,No,Ciudad de México,19.4318042,-99.1975615
,,COLMEX,"unnamed (1): 88<br>Marca temporal: 21/09/17 08:43<br>Calle: Carretera Picacho-Ajusto<br>Numero_aproximado: 20<br>Colonia: Ampliación Jardínes del Pedegral<br>Delegacion: Tlalpan<br>Nombre_contacto: Omar Areizaga<br>Telefono: 5539925202<br>Articulos_Urgentes:  herramientas y medicina (LISTERINE)<br>Alimentos_Faltantes: Chocolate en polvo y barra, Comida para mascota <br>Alimentos_Existentes: No hay<br>Medicamentos_Faltantes: Alcohol, Analgésicos, Antiséptico, Cubre bocas, Gasas, Suero, Vendas<br>Medicamentos_Existentes: No hay<br>Herramientas_Faltantes: Palas, Cascos, Picos, Cubetas<br>Herramientas_Existentes: No hay<br>Otros_Articulos: , Shampoo Jabón en barra, Desodorante, Toallas sanitarias, Papel higiénico, Pañales, <br>Horario_Atencion: 8am 12pm<br>Requieren_voluntarios: No<br>Verificado: Sí<br>Estado: Ciudad de México<br>latitud: <br>longitud:",,,,,,,-1,,,88.0,21/09/17 08:43,Carretera Picacho-Ajusto,20.0,Ampliación Jardínes del Pedegral,Tlalpan,Omar Areizaga,5539925202,herramientas y medicina (LISTERINE),"Chocolate en polvo y barra, Comida para mascota",No hay,"Alcohol, Analgésicos, Antiséptico, Cubre bocas, Gasas, Suero, Vendas",No hay,"Palas, Cascos, Picos, Cubetas",No hay,", Shampoo Jabón en barra, Desodorante, Toallas sanitarias, Papel higiénico, Pañales,",8am 12pm,No,Sí,Ciudad de México,,
-99.1786785,19.3737123,Villa Olímpica,"unnamed (1): 89<br>Marca temporal: 21/09/17 09:19<br>Calle: Insurgentes Sur<br>Numero_aproximado: 0<br>Colonia: Villa Olímpica<br>Delegacion: Tlalpan<br>Nombre_contacto: Renata Terrazas<br>Telefono: 5536594667<br>Articulos_Urgentes: Moto<br>Alimentos_Faltantes: Todosmenos comida preparada <br>Alimentos_Existentes: Varios<br>Medicamentos_Faltantes: Antiinflamatorios, antibióticos, shampoo para piojos, jarabe de tos<br>Medicamentos_Existentes: Varios <br>Herramientas_Faltantes: Ninguna<br>Herramientas_Existentes: Ninguna<br>Otros_Articulos: Moto<br>Horario_Atencion: 24 horas<br>Requieren_voluntarios: Sí<br>Verificado: Sí<br>Estado: Ciudad de México<br>latitud: 19.3737123<br>longitud: -99.1786785",,,,,-1,0,-1,,,89.0,21/09/17 09:19,Insurgentes Sur,0.0,Villa Olímpica,Tlalpan,Renata Terrazas,5536594667,Moto,Todosmenos comida preparada,Varios,"Antiinflamatorios, antibióticos, shampoo para piojos, jarabe de tos",Varios,Ninguna,Ninguna,Moto,24 horas,Sí,Sí,Ciudad de México,19.3737123,-99.1786785
-99.1762657,19.3644616,Centro de acopio de juguetes,unnamed (1): 90<br>Marca temporal: 21/09/17 09:23<br>Calle: Moras <br>Numero_aproximado: 416<br>Colonia: Del Valle<br>Delegacion: Benito Juárez <br>Nombre_contacto: Renata Terrazas<br>Telefono: 5536594667<br>Articulos_Urgentes: Juguetes y peluches en buen estado <br>Alimentos_Faltantes: NInguno<br>Alimentos_Existentes: NInguno<br>Medicamentos_Faltantes: Ninguno<br>Medicamentos_Existentes: NInguno <br>Herramientas_Faltantes: Ninguna<br>Herramientas_Existentes: Ninguna<br>Otros_Articulos: Juguetes<br>Horario_Atencion: sep-20<br>Requieren_voluntarios: No<br>Verificado: Sí<br>Estado: Ciudad de México<br>latitud: 19.3644616<br>longitud: -99.1762657,,,,,-1,0,-1,,,90.0,21/09/17 09:23,Moras,416.0,Del Valle,Benito Juárez,Renata Terrazas,5536594667,Juguetes y peluches en buen estado,NInguno,NInguno,Ninguno,NInguno,Ninguna,Ninguna,Juguetes,sep-20,No,Sí,Ciudad de México,19.3644616,-99.1762657
,,risco,unnamed (1): 91<br>Marca temporal: 21/09/17 10:03<br>Calle: Cda de risco <br>Numero_aproximado: 133<br>Colonia: Pedregal<br>Delegacion: Alvaro Obregon <br>Nombre_contacto: Maru arochi <br>Telefono: 5529559997<br>Articulos_Urgentes: Cobijas palas y picos<br>Alimentos_Faltantes: No perecederos <br>Alimentos_Existentes: Perecederos<br>Medicamentos_Faltantes: Todos<br>Medicamentos_Existentes: No<br>Herramientas_Faltantes: Palas y picos<br>Herramientas_Existentes: No<br>Otros_Articulos: Ropa<br>Horario_Atencion: 10 a 7<br>Requieren_voluntarios: No<br>Verificado: Sí<br>Estado: Ciudad de México<br>latitud: <br>longitud:,,,,,,,-1,,,91.0,21/09/17 10:03,Cda de risco,133.0,Pedregal,Alvaro Obregon,Maru arochi,5529559997,Cobijas palas y picos,No perecederos,Perecederos,Todos,No,Palas y picos,No,Ropa,10 a 7,No,Sí,Ciudad de México,,
-99.1709338,19.419062,Mexsi Bocu,"unnamed (1): 92<br>Marca temporal: 21/09/17 10:27<br>Calle: Durango<br>Numero_aproximado: 359<br>Colonia: Roma Norte<br>Delegacion: Cuauhtémoc<br>Nombre_contacto: Anna Sorrentino<br>Telefono: 6121595793<br>Articulos_Urgentes: Cajas<br>Alimentos_Faltantes: Comida no perecedera<br>Alimentos_Existentes: Comida preparada, comida no perecedera (latas, leche en polvo, café, galletas) <br>Medicamentos_Faltantes: kits de primeros auxilios<br>Medicamentos_Existentes: Insulina, metformina, kits de primeros auxilios (gasas, alcohol, paracetamol, isodine, jeringas)<br>Herramientas_Faltantes: Palas y picos<br>Herramientas_Existentes: Palas y picos<br>Otros_Articulos: papel de baño, jabón, agua, cobijas, ropa, guantes, productos de limpieza y de higiene personal<br>Horario_Atencion: <br>Requieren_voluntarios: No<br>Verificado: Sí<br>Estado: Ciudad de México<br>latitud: 19.419062<br>longitud: -99.1709338",,,,,-1,0,-1,,,92.0,21/09/17 10:27,Durango,359.0,Roma Norte,Cuauhtémoc,Anna Sorrentino,6121595793,Cajas,Comida no perecedera,"Comida preparada, comida no perecedera (latas, leche en polvo, café, galletas)",kits de primeros auxilios,"Insulina, metformina, kits de primeros auxilios (gasas, alcohol, paracetamol, isodine, jeringas)",Palas y picos,Palas y picos,"papel de baño, jabón, agua, cobijas, ropa, guantes, productos de limpieza y de higiene personal",,No,Sí,Ciudad de México,19.419062,-99.1709338
-99.1485699,19.3427151,Marabunta Café,"unnamed (1): 93<br>Marca temporal: 21/09/17 10:50<br>Calle: Miguel Ángel de Quevedo<br>Numero_aproximado: 485<br>Colonia: Romero de Terreros<br>Delegacion: Coyoacán<br>Nombre_contacto: Juan Carlos Narvaez<br>Telefono: 044 55 5969 3176<br>Articulos_Urgentes: Ninguna<br>Alimentos_Faltantes: Cualquiera<br>Alimentos_Existentes: Agua<br>Medicamentos_Faltantes: Cualquiera<br>Medicamentos_Existentes: Jeringas, gasas<br>Herramientas_Faltantes: Cualquiera<br>Herramientas_Existentes: Ninguna<br>Otros_Articulos: Cajas<br>Horario_Atencion: 9 am a 8 pm<br>Requieren_voluntarios: No<br>Verificado: Sí<br>Estado: Ciudad de México<br>latitud: 19.3427151<br>longitud: -99.1485699",,,,,-1,0,-1,,,93.0,21/09/17 10:50,Miguel Ángel de Quevedo,485.0,Romero de Terreros,Coyoacán,Juan Carlos Narvaez,044 55 5969 3176,Ninguna,Cualquiera,Agua,Cualquiera,"Jeringas, gasas",Cualquiera,Ninguna,Cajas,9 am a 8 pm,No,Sí,Ciudad de México,19.3427151,-99.1485699
-99.1846252,19.404049,Mega Comercial,unnamed (1): 94<br>Marca temporal: 21/09/17 10:56<br>Calle: Avenida Revolución<br>Numero_aproximado: 780<br>Colonia: Nonoalco<br>Delegacion: Ciudad de México<br>Nombre_contacto: Directamente los de la comercial<br>Telefono: No<br>Articulos_Urgentes: No<br>Alimentos_Faltantes: Gente puede donar sus compras del centro comercial<br>Alimentos_Existentes: No<br>Medicamentos_Faltantes: No<br>Medicamentos_Existentes: NO<br>Herramientas_Faltantes: No<br>Herramientas_Existentes: NO<br>Otros_Articulos: No<br>Horario_Atencion: 8 am a 4 pm<br>Requieren_voluntarios: No<br>Verificado: Sí<br>Estado: Ciudad de México<br>latitud: 19.404049<br>longitud: -99.1846252,,,,,-1,0,-1,,,94.0,21/09/17 10:56,Avenida Revolución,780.0,Nonoalco,Ciudad de México,Directamente los de la comercial,No,No,Gente puede donar sus compras del centro comercial,No,No,NO,No,NO,No,8 am a 4 pm,No,Sí,Ciudad de México,19.404049,-99.1846252
-99.1847606,19.3808815,Fonart,"unnamed (1): 95<br>Marca temporal: 21/09/17 11:03<br>Calle: Patriotismo <br>Numero_aproximado: 691<br>Colonia: Nonoalco<br>Delegacion: Ciudad México<br>Nombre_contacto: Cordinados con CEDESOL, de manera oficial<br>Telefono: No<br>Articulos_Urgentes: Equipo médico, insumos<br>Alimentos_Faltantes: Alimentos de animales<br>Alimentos_Existentes: No<br>Medicamentos_Faltantes: gasas, alcohol, medicamentos, papel higénico, toallas sanitarias, guantes, material de curación<br>Medicamentos_Existentes: No<br>Herramientas_Faltantes: No<br>Herramientas_Existentes: NO<br>Otros_Articulos: Agua embotellada, paniales<br>Horario_Atencion: 24 hs<br>Requieren_voluntarios: No<br>Verificado: Sí<br>Estado: Ciudad de México<br>latitud: 19.3808815<br>longitud: -99.1847606",,,,,-1,0,-1,,,95.0,21/09/17 11:03,Patriotismo,691.0,Nonoalco,Ciudad México,"Cordinados con CEDESOL, de manera oficial",No,"Equipo médico, insumos",Alimentos de animales,No,"gasas, alcohol, medicamentos, papel higénico, toallas sanitarias, guantes, material de curación",No,No,NO,"Agua embotellada, paniales",24 hs,No,Sí,Ciudad de México,19.3808815,-99.1847606
-99.1703704,19.3739026,Centro de Acopio Subdelegación 7 IMSS,unnamed (1): 96<br>Marca temporal: 21/09/17 11:05<br>Calle: Av. Coyoacán<br>Numero_aproximado: 1540<br>Colonia: Del Valle<br>Delegacion: Benito Juárez<br>Nombre_contacto: Suhayla Bazbaz <br>Telefono: 5519090005<br>Articulos_Urgentes: Nd<br>Alimentos_Faltantes: De todo<br>Alimentos_Existentes: De todo<br>Medicamentos_Faltantes: Nd<br>Medicamentos_Existentes: De todo<br>Herramientas_Faltantes: De todo<br>Herramientas_Existentes: Nd<br>Otros_Articulos: Nd<br>Horario_Atencion: 8 a 5 <br>Requieren_voluntarios: No<br>Verificado: Sí<br>Estado: Ciudad de México<br>latitud: 19.3739026<br>longitud: -99.1703704,,,,,-1,0,-1,,,96.0,21/09/17 11:05,Av. Coyoacán,1540.0,Del Valle,Benito Juárez,Suhayla Bazbaz,5519090005,Nd,De todo,De todo,Nd,De todo,De todo,Nd,Nd,8 a 5,No,Sí,Ciudad de México,19.3739026,-99.1703704
-99.1847606,19.3808815,,"unnamed (1): 97<br>Marca temporal: 21/09/17 11:27<br>Calle: Patriotismo<br>Numero_aproximado: 733<br>Colonia: Nonoalco Mixcoac<br>Delegacion: Benito Juárez<br>Nombre_contacto: Juliana González (encargada)<br>Telefono: 5522997188<br>Articulos_Urgentes: ninguno en particular, está iniciando y se recibe todo y se canaliza de otros albergues<br>Alimentos_Faltantes: todo tipo<br>Alimentos_Existentes: ninguno<br>Medicamentos_Faltantes: todo tipo<br>Medicamentos_Existentes: ninguno<br>Herramientas_Faltantes: todo tipo<br>Herramientas_Existentes: ninguno<br>Otros_Articulos: alimentos para perros<br>Horario_Atencion: 21 de septiembre TODO EL DIA. NO durante la noche<br>Requieren_voluntarios: No<br>Verificado: Sí<br>Estado: Ciudad de México<br>latitud: 19.3808815<br>longitud: -99.1847606",,,,,-1,0,-1,,,97.0,21/09/17 11:27,Patriotismo,733.0,Nonoalco Mixcoac,Benito Juárez,Juliana González (encargada),5522997188,"ninguno en particular, está iniciando y se recibe todo y se canaliza de otros albergues",todo tipo,ninguno,todo tipo,ninguno,todo tipo,ninguno,alimentos para perros,21 de septiembre TODO EL DIA. NO durante la noche,No,Sí,Ciudad de México,19.3808815,-99.1847606
-99.1712355,19.377925,Centro de Acopio Tlacoquemécatl,"unnamed (1): 98<br>Marca temporal: 21/09/17 11:27<br>Calle: Tlacoquemécatl<br>Numero_aproximado: 218<br>Colonia: Del Valle<br>Delegacion: Benito Juárez<br>Nombre_contacto: Jorge Arias de Sariñana<br>Telefono: 5540554542, 55593885<br>Articulos_Urgentes: Nd<br>Alimentos_Faltantes: Alimentos no perecederos, enlatados, arroz, café, frijoles, lentejas, galletas, agia, azúcar, sal <br>Alimentos_Existentes: Nd<br>Medicamentos_Faltantes: Nd<br>Medicamentos_Existentes: Ofrecen consulta médica, consulta psicológica, consulta dental<br>Herramientas_Faltantes: Nd<br>Herramientas_Existentes: Nd<br>Otros_Articulos: Cloro, jergas, detergente, cubetas, franelas, limpiador<br>Horario_Atencion: De 10 a 8<br>Requieren_voluntarios: No<br>Verificado: Sí<br>Estado: Ciudad de México<br>latitud: 19.377925<br>longitud: -99.1712355",,,,,-1,0,-1,,,98.0,21/09/17 11:27,Tlacoquemécatl,218.0,Del Valle,Benito Juárez,Jorge Arias de Sariñana,"5540554542, 55593885",Nd,"Alimentos no perecederos, enlatados, arroz, café, frijoles, lentejas, galletas, agia, azúcar, sal",Nd,Nd,"Ofrecen consulta médica, consulta psicológica, consulta dental",Nd,Nd,"Cloro, jergas, detergente, cubetas, franelas, limpiador",De 10 a 8,No,Sí,Ciudad de México,19.377925,-99.1712355
,,Universidad Iberoamericana Puebla,"unnamed (1): 99<br>Marca temporal: 21/09/17 11:47<br>Calle: Blvd. Del Niño Poblano · <br>Numero_aproximado: 2901<br>Colonia: Reserva Territorial Atlixcáyotl <br>Delegacion: Puebla<br>Nombre_contacto: Yatziri Zepeda<br>Telefono: 2227208799<br>Articulos_Urgentes: picos, palas, guantes, cubetas<br>Alimentos_Faltantes: atún, jamón, pan de caja, mayonesa, frijoles, lentejas, azúcar, pastas, jabón, pastas dentales, detergente, toallas sanitarias, pañales, papel higiénico, <br>Alimentos_Existentes: -<br>Medicamentos_Faltantes: -<br>Medicamentos_Existentes: -<br>Herramientas_Faltantes: picos, palas, guantes, cubetas, cortadoras de varillas<br>Herramientas_Existentes: -<br>Otros_Articulos: -<br>Horario_Atencion: 24 horas <br>Requieren_voluntarios: No<br>Verificado: Sí<br>Estado: Puebla<br>latitud: <br>longitud:",,,,,,,-1,,,99.0,21/09/17 11:47,Blvd. Del Niño Poblano ·,2901.0,Reserva Territorial Atlixcáyotl,Puebla,Yatziri Zepeda,2227208799,"picos, palas, guantes, cubetas","atún, jamón, pan de caja, mayonesa, frijoles, lentejas, azúcar, pastas, jabón, pastas dentales, detergente, toallas sanitarias, pañales, papel higiénico,",-,-,-,"picos, palas, guantes, cubetas, cortadoras de varillas",-,-,24 horas,No,Sí,Puebla,,
